,제목,가수,가사,좋아요
73,Same Wind,Jonah Kagen,"I'm sat here watchin' this bird fly high on the
Mountain
Nothin' around him
But the wind

He's riding that wind to somewhere lookin' for somethin'
Got ties to nothin'
Is that what you want?

'Cause I'm lookin' at you
And you're lookin' at me
You're watchin' me break and I'm watchin' you bleed

I'm lookin' at you
And you're lookin' right back
You see a boy and I see all that I have

You said you need to fly wherever you want to
I ain't gonna stop you
I'll be fine

Darlin', I hope you find whatever you want to
I would have come with you
If you had asked

It's funny how life brings strangers right to your doorstep
And we say, ""Come on in
Stay a while""

Then it's the same wind that burns out a candle that fans a bonfire
And suddenly your heart's tired
And you're up in smoke

'Cause I'm lookin' at you
And you're lookin' at me
You're watchin' me break and I'm watchin' you bleed

I'm lookin' at you
And you're lookin' right back
You see a boy and I see all that I have

You said you need to fly wherever you want to
I ain't gonna stop you
I'll be fine

Darlin', I hope you find whatever you want to
I would have come with you
If you had asked

I would have come with you
If you had asked

I would have come with you
If you had asked
marie 님이 등록해 주신 가사입니다.
가사 오류 제보",6
74,晩餐歌,tuki.,"君を泣かすから だから一緒には居れないな
君を泣かすから 早く忘れて欲しいんだ
人間だからね たまには違うものも食べたいね
君を泣かすから そう君を泣かすから

でも味気ないんだよね
会いたくなんだよね
君以外会いたくないんだよね
なんて勝手だね
大体曖昧なんだよね
愛の存在証明なんて
君が教えてくれないか

何十回の夜を過ごしたって得られぬような
愛してるを並べてみて
何十回の夜を過ごしたって得られぬような
最高のフルコースを頂戴

君を泣かすから きっと一生は無理だよね
君を泣かすから 胸がとても痛くなんだ
人間だからね たまには分かり合えなくなって
君を泣かすから また君を泣かすから

でも自信がないんだよね
変わりたくないんだよね
君以外会いたくないんだよね
なんて勝手だね
大体曖昧だったよね
愛の存在証明なんて
君がそこに居るのにね

何百回の夜を過ごしたって得られぬような
愛してるを並べてみて
何百回の夜を過ごしたって得られぬような
最高のフルコースを頂戴

離れないで 傍に居てくれたのは
結局君一人だったよね
涙のスパイスは君の胸に
残ってしまうだろうけど

何千回の夜を過ごしたって得られぬような
愛してるを並べるから
何千回の夜を過ごしたって得られぬような
最高のフルコースを
何万回の夜を過ごしたって忘れぬような
愛してるを並べるから
何万回夜を過ごしたって忘れぬような
最高のフルコースを頂戴
Bugs 님이 등록해 주신 가사입니다.
가사 오류 제보",459
75,Left and Right (Feat. Jung Kook of BTS),Charlie Puth(찰리 푸스),"Memories follow me left and right 
I can feel you over here I can feel you over here 
you take up every corner of my mind 
whatcha gon do now 

ever since the da day y-you went away
no I don't know how 
how to erase your body from out my brain 
whatcha gon do now
maybe I should just focus on me instead
But all I think about 
are the nights we were tangled up in your bed

oh no (oh no)
oh no (oh no)
you're going round in circles got you stuck up 
in my head (yeah)

Memories follow me left and right 
I can feel you over here I can feel you over here 
you take up every corner of my mind 
your love stays with me day and night 
I can feel you over here I can feel you over here 
you take up every corner of my mind 
whatcha gon do now

ever since the da da day y-you went away 
someone tell me how 
how much more do I gotta drink for the pain 
whatcha gon do now
you did things to me that I just can't forget 
now all I think about 
are the nights we were tangled up in your bed 
oh no (oh no)
oh no (oh no)
you're going round in circles 
got ya stuck up in my head 

Memories follow me left and right 
I can feel you over here I can feel you over here 
you take up every corner of my mind 
your love stays with me day and night 
I can feel you over here I can feel you over here 
you take up every corner of my mind 
whatcha gon do now

did ya know you're the one that got away
and even now baby i'm still not ok 
did ya know that my dreams
they're are the same 
everytime I close my eyes 

Memories follow me left and right 
I can feel you over here I can feel you over here 
you take up every corner of my mind 
whatcha gon do now
your love stays with me day and night 
I can feel you over here i can feel you over here 
you take up every corner of my mind 
whatcha gon do now

I can feel you over here I can feel you over here
you take up every corner of my mind 
whatcha gon do now
Bugs 님이 등록해 주신 가사입니다.
가사 오류 제보","5,248"
76,I Don't Mind,Vidi Aldiano,"가사 준비 중입니다. 일반 가사 신청 실시간 가사 신청
벅스패널이 되면 가사를 등록하실 수 있습니다. 벅스패널이란?",11
77,Bad Habits,Ed Sheeran(에드 시런),"Every time you come around
you know I can't say no 
Every time the sun goes down
I let you take control
I can feel the paradise
before my world implodes
and tonight had something wonderful

My bad habits lead to late nights ending alone
Conversations with a stranger I barely know
Swearing this will be the last,
but it probably won't
I've got nothing left to lose, or use, or do
My bad habits to lead to
wide eyes stare into space
And I know I lose control
of the things that I say
I was looking for a way out,
now I can't escape 
Nothing happens after two
It's true it's true
My bad habits lead to you
My bad habits lead to you

Every pure intention ends
when the good times start
Falling over everything to
reach the first times spark
Started under neon lights then it all got dark 
I only know how to go too far 

My bad habits lead to late nights ending alone
Conversations with a stranger I barely know
Swearing this will be the last,
but it probably won't
I've got nothing left to lose, or use, or do
My bad habits to lead to
wide eyes stare into space
And I know I lose control
of the things that I say
I was looking for a way out,
now I can't escape 
Nothing happens after two
It's true it's true
My bad habits lead to you
My bad habits lead to you

We took the long way round
And burned til the fun ran out, now

My bad habits lead to late nights ending alone
Conversations with a stranger I barely know
Swearing this will be the last,
but it probably won't
I've got nothing left to lose, or use, or do
My bad habits to lead to
wide eyes stare into space
And I know I lose control
of the things that I say
I was looking for a way out,
now I can't escape 
Nothing happens after two
It's true it's true
My bad habits lead to you
My bad habits lead to you
My bad habits lead to you
Bugs 님이 등록해 주신 가사입니다.
가사 오류 제보","6,886"
78,Fri,Thor Farlov,"가사 준비 중입니다. 일반 가사 신청 실시간 가사 신청
벅스패널이 되면 가사를 등록하실 수 있습니다. 벅스패널이란?",6
79,"[19금] Peaches (feat. Daniel Caesar, Giveon)",Justin Bieber(저스틴 비버),"청소년 보호법에 따라 19세 미만의 청소년이 이용할 수 없습니다.
성인 인증 후 이용해 주세요. (연 1회)
성인 인증 하기","11,361"
80,Loving You Girl (feat. Hkeem),Peder Elias,"Loving you girl is such a lonely feeling
Whatever I say or do
I'll always be lost in you
When you told me forever more, 
I must have been dreaming
This picture of you and me
Oh, wasn’t it meant to be?

Jump into a cab on fifty-ninth street
I say to the driver, “Make a right”
Stare into the rain outside the window

‘Cause I don't know
But I wish I knew
Baby, where you are tonight
(I miss you...)

Loving you girl is such a lonely feeling
Whatever I say or do
I'll always be lost in you
When you told me forever more, 
I must have been dreaming
This picture of you and me
Oh, wasn’t it meant to be?

We used to play house way out in Brooklyn
In the middle of July we had a fight
Now I'm looking at this little dent on my pillow

And I don't know
But I wish I knew
Baby, where you are tonight

Loving you girl is such a lonely feeling
Whatever I say or do
I'll always be lost in you
When you told me forever more, 
I must have been dreaming
This picture of you and me
Oh, wasn't it meant to be?

Girl, let me know
I'll go anywhere
We can fly, fly, fly
We'd go anywhere
You and me were unstoppable
Ain't no one like you,
 you’re unswappable
Do you recall, we were happy
From the start, girl you had me
Like a bumblebee burning slowly
‘Cause loving you girl got me lonely

Loving you girl is such a lonely feeling
(Such a lonely feeling)Whatever I say or do
I’ll always be lost in you(I'm missing you..)
When you told me forever more,
 I must have been dreaming
This picture of you and me
Oh, wasn't it meant to be?

Loving you girl, it’s such a lonely feeling
Whatever I say or do
I'll always be lost in you
When you told me forever more,
 I must have been dreaming
This picture of you and me
Oh, wasn't it meant to be?...
marie 님이 등록해 주신 가사입니다.
가사 오류 제보","8,359"
81,Pretender,OFFICIAL HIGE DANDISM,"君とのラブストーリー
키미토노 라브스토-리
너와의 러브 스토리
それは予想通り
소레와 요소오도오리
그것은 예상대로
いざ始まればひとり芝居だ
이자 하지마레바 히토리시바이다
막상 시작하니 홀로 하는 연극이었어
ずっとそばにいたって
즛토 소바니이탓테
계속 옆에 있어도
結局ただの観客だ
켁쿄쿠 타다노 칸캬쿠다
결국 그냥 관객이야



感情のないアイムソーリー
칸죠노나이 아이무 소-리
감정이 없는 I’m sorry
それはいつも通り
소레와 이츠모도오리
그건 항상 그렇듯이
慣れてしまえば悪くはないけど
나레테시마에바 와루쿠와나이케도
익숙해져보니 나쁘진 않지만
君とのロマンスは人生柄
키미토노 로망스와 진세이가라
너와의 로맨스는 인생에서
続きはしないことを知った
츠즈키와 시나이코토오 싯타
계속되진 않을 거라는 걸 알았어



もっと違う設定で　もっと違う関係で
못토 치가우 셋테이데 못토 치가우 칸케이데
조금 더 다른 설정으로 조금 더 다른 관계로
出会える世界線　選べたらよかった
데아에루 세카이센 에라베타라 요캇타
만날 수 있는 세계선을 골랐다면 좋았을 걸
もっと違う性格で　もっと違う価値観で
못토 치가우 세이카쿠데 못토 치가우 카치칸데
조금 더 다른 성격으로 조금 더 다른 가치관으로
愛を伝えられたらいいな　
아이오츠타에라레타라 이이나
사랑을 전할 수 있었으면 좋겠다
そう願っても無駄だから
소오 네갓테모 무다다카라
그렇게 빌어도 소용없으니까
グッバイ
굿바이
Goodbye



君の運命のヒトは僕じゃない
키미노 운메이노 히토와 보쿠쟈나이
너의 운명의 사람은 내가 아냐
辛いけど否めない
츠라이케도 이나메나이 
괴롭지만 부정할 수 없어 
でも離れ難いのさ
데모 하나레가타이노사
하지만 멀어지긴 어렵네
その髪に触れただけで　
소노카미니 후레타다케데 
그 머리카락에 닿은 것 만으로도
痛いやいやでも
이타이야 이야데모
아파 아냐 그래도
甘いな　いやいや
아마이나 이야이야
달콤하구나 아냐아냐
グッバイ
굿바이
Goodbye



それじゃ僕にとって君は何？
소레쟈 보쿠니 톳테 키미와 나니?
그렇다면 내게 너는 어떤 존재야?
答えは分からない　分かりたくもないのさ
코타에와 와카라나이 와카리타쿠모나이노사
정답은 알 수 없어 알고 싶지도 않아
たったひとつ確かなことがあるとするのならば
탓타 히토츠 타시카나 코토가 아루토 스루노나라바
딱 하나 확실한 것이 있다고 한다면
「君は綺麗だ」
“키미와 키레이다”
“넌 아름다워”



誰かが偉そうに
다레카가 에라소오니
누군가가 잘난 듯이
語る恋愛の論理
카타루 렌아이노 론리
말하는 연애의 논리
何ひとつとしてピンとこなくて
나니 히토츠토시테 핀토 코나쿠테
무엇 하나도 딱 꽂히는게 없어서
飛行機の窓から見下ろした
히코오키노 마도카라 미오로시타
비행기의 창밖으로 내려다 본
知らない街の夜景みたいだ
시라나이 마치노 야케이미타이다
모르는 거리의 야경같아



もっと違う設定で　もっと違う関係で
못토 치가우 셋테이데 못토 치가우 칸케이데
조금 더 다른 설정으로 조금 더 다른 관계로
出会える世界線　選べたらよかった
데아에루 세카이센 에라베타라 요캇타
만날 수 있는 세계선을 골랐어야 했어
いたって純な心で　叶った恋を抱きしめて
이탓테 쥰나 코코로데 카낫타 코이오 다키시메테
아주 순수한 마음으로 이뤄진 사랑을 감싸안고
「好きだ」とか無責任に言えたらいいな
“스키다”토 무세키닌니 이에타라 이이나
“좋아해”라고 무책임하게 말할 수 있다면 좋겠어
そう願っても虚しいのさ
소오 네갓테모 무나시이노사
그렇게 빌어도 허무할 뿐야
グッバイ
굿바이
Goodbye



繋いだ手の向こうにエンドライン
츠나이다 테노 무코오니 엔도라인
잡은 손의 저 편에 있는 엔드 라인
引き伸ばすたびに　疼きだす未来には
히키노바스타비니 우즈키다스 미라이니와
잡아 늘릴 때마다 꿈틀거리는 미래에는
君はいないその事実に Cry…
키미와 이나이 소노 지지츠니 Cry...
너는 없어 그 사실에 Cry...
そりゃ苦しいよな
소랴 쿠루시이요나
그야 괴롭겠지
グッバイ
굿바이
Goodbye



君の運命のヒトは僕じゃない
키미노 운메이노 히토와 보쿠쟈나이
너의 운명의 사람은 내가 아냐
辛いけど否めない
츠라이케도 이나메나이 
괴롭지만 부정할 수 없어 
でも離れ難いのさ
데모 하나레가타이노사
하지만 멀어지긴 어렵네
その髪に触れただけで　
소노카미니 후레타다케데 
그 머리카락에 닿은 것 만으로도
痛いやいやでも
이타이야 이야데모
아파 아냐 그래도
甘いな　いやいや
아마이나 이야이야
달콤하구나 아냐아냐
グッバイ
굿바이
Goodbye



それじゃ僕にとって君は何？
소레쟈 보쿠니 톳테 키미와 나니?
그렇다면 나에게 있어 너는 어떤 존재야?
答えは分からない　分かりたくもないのさ
코타에와 와카라나이 와카리타쿠모나이노사
정답은 알 수 없어 알고 싶지도 않아
たったひとつ確かなことがあるとするのならば
탓타 히토츠 타시카나 코토가 아루토 스루노나라바
딱 하나 확실한 것이 있다고 한다면
「君は綺麗だ」
“키미와 키레이다”
“넌 아름다워”



それもこれもロマンスの定めなら
소레모 코레모 로망스노 사다메나라　
이것도 저것도 로맨스의 운명이라면
悪くないよな
와루쿠나이요나
나쁘진 않구나
永遠も約束もないけれど
에이엔모 야쿠소쿠모 나이케레도
영원도 약속도 없지만
「とても綺麗だ」
“도테모 키레이다”
“정말 아름다워”
위텤잇슬로 님이 등록해 주신 가사입니다.
가사 오류 제보","2,184"
82,Heaven or Hell,Chris James,"가사 준비 중입니다. 일반 가사 신청 실시간 가사 신청
벅스패널이 되면 가사를 등록하실 수 있습니다. 벅스패널이란?",33
83,Attention,Charlie Puth(찰리 푸스),"You've been runnin' round runnin' round
Runnin' round throwin' that dirt all on my name
'Cause you knew that I knew that I
Knew that I'd call you up
You've been going round going round
Going round every party in la
'Cause you knew that I knew that I
Knew that I'd be at one
I know that dress is karma perfume regret
You got me thinking 'bout when you were mine
And now I'm all up on ya what you expect
But you're not coming home with me tonight
You just want attention
You don't want my heart
Maybe you just hate the thought of me
With someone new
Yeah you just want attention
I knew from the start
You're just making sure
I'm never gettin' over you
You've been runnin' round runnin' round
Runnin' round throwing that dirt all on my name
'Cause you knew that I knew that I
Knew that I'd call you up
Baby now that we're now that we're
Now that we're right here standing face to face
You already know already know
Already know that you won
Ohh
I know that dress is karma (Dress is karma)
Perfume regret
You got me thinking 'bout when you were mine
(You got me thinking 'bout when you were mine)
And now I'm all up on ya (All up on ya)
What you expect (Oh baby)
But you're not coming home with me tonight
(Oh no)
You just want attention
You don't want my heart
Maybe you just hate the thought of me
With someone new
Yeah you just want attention
I knew from the start
You're just making sure
I'm never gettin' over you
Ohh
What are you doin' to me?
What are you doin' huh? (What are you doin'?)
What are you doin' to me?
What are you doin' huh? (What are you doin'?)
What are you doin' to me?
What are you doin' huh? (What are you doin'?)
What are you doin' to me?
What are you doin' huh?
I know that dress is karma perfume regret
You got me thinking 'bout when you were mine
And now I'm all up on ya what you expect
But you're not coming home with me tonight
You just want attention
You don't want my heart
Maybe you just hate the thought of me
With someone new
Yeah you just want attention
I knew from the start
You're just making sure
I'm never gettin' over you
(Over you)
What are you doin' to me? (Heyy)
What are you doin' huh?
(What are you doin' what?)
What are you doin' to me?
What are you doin' huh?
(Yeah you just want attention)
What are you doin' to me?
(I knew from the start)
What are you doin' huh?
(You're just making sure
I'm never gettin' over you)
What are you doin' huh?
bbbgold 님이 등록해 주신 가사입니다.
가사 오류 제보","18,314"
84,Sugar,Maroon 5(마룬 파이브),"I'm hurting baby I'm broken down
I need your loving loving
I need it now
When I'm without you
I'm something weak
You got me begging begging
I'm on my knees
I don't wanna be needing your love
I just wanna be deep in your love
And it's killing me when you're away
Ooh baby 'Cause I really
Don't care where you are
I just wanna be there where you are
And I gotta get one little taste
Sugar
Yes please
Won't you come and put it down on me
Oh right here cause I need
Little love and little sympathy
Yeah you show me good loving
Make it alright
Need a little a sweetness in my life
Sugar
Yes please
Won't you come and put it down on me
My broken pieces
You put them up
Don't leave me hanging hanging
Come get me some
When I'm without ya
So insecure
You are the one thing one thing
I'm living for
I don't wanna be needing your love
I just wanna be deep in your love
And it's killing me when you're away
Ooh baby cause a bullet
Don't care where you are
I just wanna be there where you are
And I gotta get one little taste
Sugar
Yes please
Won't you come and put it down on me
Oh right here cause I need
Little love and little sympathy
Yeah you show me good loving
Make it alright
Need a little a sweetness in my life
Sugar
Yes please
Won't you come and put it down on me
Yeah I want that red velvet
I want that sugar sweet
Don't let nobody touch it
Unless that somebody is me
I gotta be a man
There ain't no other way
Cause girl you're hotter than
Southern california bay
I don't wanna play no games
I don't gotta be afraid
Don't give all that shy sh t
No make up on that's my
Sugar yes please
Won't you come and put it down on me
Oh right here cause I need
Little love and little sympathy
Yeah you show me good loving
Make it alright
Need a little a sweetness in my life
Sugar
Yes please
Won't you come and put it down on me
Sugar
Yes please
Won't you come and put it down on me
Oh right here cause I need
Little love and little sympathy
Yeah you show me good loving
Make it alright
Need a little a sweetness in my life
Sugar
Yes please
Won't you come and put it down on me
Down on me down on me
Bugs 님이 등록해 주신 가사입니다.
가사 오류 제보","15,985"
85,LADY,Kenshi Yonezu(켄시 요네즈/米津 玄師),"例えば僕ら二人 煌めく映画のように
出会いなおせたらどうしたい
何も謎めいてない 今日は昨日の続き
日々は続くただぼんやり
微かな足音 シーツの置く場所
それだけで全てわかってしまうよ
見え透いた嘘も隠した本当も
その全て愛おしかった
レディー 笑わないで聞いて
ハニー 見つめ合っていたくて
君と二人 行ったり来たりしたいだけ
ベイビー 子供みたいに恋がしたい
書き散らしていく僕らのストーリーライン
例えばどっちか一人 ひどい不幸が襲い
二度と会えなくなったら
考えた矢先に 泣けてしまうくらい
日々は続く一層確かに
いつもの暗い顔 チープな戯言
見過ごすようにまた優しいんだろう
見え透いた嘘も隠した本当も
その目から伝わってきた
引っ張ったり噛み付いたり
傷ついたふりしてみたり
明日の朝に持ち越したり
浮ついたりして
思いきり傷つきたい
いつまでもそばにいたい
今すぐ行方をくらまそう
(Oh oh ah)
レディー 何も言わないで
ハニー 僕の手を取ってくれ
君以外に 考えられないだけ
ベイビー あの頃みたいに恋がしたい
書き散らしていく 踊り続ける
レディー 笑わないで聞いて
ハニー 見つめ合っていたくて
君と二人 行ったり来たりしたいだけ
ベイビー 子供みたいに恋がしたい
書き散らしていく僕らのストーリーライン
Bugs 님이 등록해 주신 가사입니다.
가사 오류 제보","1,219"
86,Songs In My Head,HONNE(혼네),"가사 준비 중입니다. 일반 가사 신청 실시간 가사 신청
벅스패널이 되면 가사를 등록하실 수 있습니다. 벅스패널이란?",6
87,Please Please Please,Sabrina Carpenter(사브리나 카펜터),"I know I have good judgment 
I know I have good taste
It's funny and it's ironic 
that only I feel that way
I promise 'em that you're different 
and everyone makes mistakes
But just don't
I heard that you're an actor 
so act like a stand-up guy
Whatever devil's inside you 
don't let him out tonight
I tell them it's just your culture 
and everyone rolls their eyes
Yeah I know
All I'm asking baby

Please please please
Don't prove I'm right
And please please please
Don't bring me to tears 
when I just did my makeup so nice
Heartbreak is one thing my ego's another
I beg you don't embarrass me motherfucker
Ah-ooh
Please please please (Ah-ah-ah)

Well I have a fun idea babe (Uh-huh) 
maybe just stay inside
I know you're craving some fresh air 
but the ceiling fan is so nice (It's so nice right?)
And we could live so happily 
if no one knows that you're with me
I'm just kidding 
but really (Kinda) really really

Please please please 
(Please don't prove I'm right)
Don't prove I'm right
And please please please
Don't bring me to tears 
when I just did my makeup so nice
Heartbreak is one thing 
(Heartbreak is one thing) 
my ego's another (Ego's another)
I beg you don't embarrass me motherfucker
Ah-oh
Please please please (Ah-ah-ah)

If you wanna go and be stupid
Don't do it in front of me
If you don't wanna cry to my music
Don't make me hate you prolifically
Please please please (Please)
Please please please (Please)
Please (Please) please (Please) please
(Ah-ah-ah-ah-ah ah-ah ah ah)
sbyr9521 님이 등록해 주신 가사입니다.
가사 오류 제보",339
